{
  "schema_version": "signalforge/technology20-peer-evaluation/v1",
  "universe_id": "us-technology-20-v2",
  "as_of": "2026-07-24T10:32:53.677641Z",
  "policy_version": "metric-comparability-annual-duration/v1",
  "lanes": [
    {
      "lane_id": "cisco-arista",
      "company_ids": [
        "sec-cik:0000858877",
        "sec-cik:0001596532"
      ],
      "receipts": [
        {
          "schema_version": "signalforge/metric-comparability-receipt/v2",
          "receipt_id": "comparability-5cd03472b6d35e4906032c3c",
          "request_id": "comparison-cisco-arista-financial-revenue-growth",
          "run_id": "peer-evaluation-cisco-arista",
          "lane_id": "cisco-arista",
          "as_of": "2026-07-24T10:32:53.677641Z",
          "operands": [
            {
              "company_id": "sec-cik:0000858877",
              "security_id": "ticker:CSCO",
              "source_observation_ids": [
                "sec-companyfacts:bf9a144ec54f757f5e9ce00b7dacc7fb806f3107af8379e9daa9319b2d3723b4",
                "sec-companyfacts:efe62f638e98b63ab25fd25bc32c5f3331c70f6a223da29fce3ac38bd77b7e21"
              ],
              "source_hashes": [
                "bf9a144ec54f757f5e9ce00b7dacc7fb806f3107af8379e9daa9319b2d3723b4",
                "efe62f638e98b63ab25fd25bc32c5f3331c70f6a223da29fce3ac38bd77b7e21"
              ],
              "available_at": "2025-09-03T20:52:59Z",
              "retrieved_at": "2026-07-24T10:32:53Z",
              "canonical_metric_id": "financial.revenue_growth",
              "metric_version": "1.0.0",
              "taxonomy_concept": "RevenueFromContractWithCustomerExcludingAssessedTax",
              "extension_mapping_id": "company-specific-us-gaap-revenues/v1:RevenueFromContractWithCustomerExcludingAssessedTax",
              "value": "0.05298961024478188948571640986562088",
              "unit": "ratio",
              "scale": 0,
              "sign_policy": "formula_defined",
              "dimensional_identity": "consolidated",
              "period_type": "duration",
              "fiscal_start": "2024-07-28T00:00:00Z",
              "fiscal_end": "2025-07-26T00:00:00Z",
              "filing_date": "2025-09-03T20:52:59Z",
              "accounting_perimeter": "revenue_current=consolidated_periodic_filing;revenue_prior=consolidated_periodic_filing",
              "accounting_inputs": [
                {
                  "input_id": "revenue_current",
                  "canonical_input": "revenue",
                  "mapping_key": "sec-cik:0000858877|revenue|us-gaap|RevenueFromContractWithCustomerExcludingAssessedTax|consolidated_periodic_filing",
                  "taxonomy_concept": "RevenueFromContractWithCustomerExcludingAssessedTax",
                  "accounting_perimeter": "consolidated_periodic_filing",
                  "disposition": "canonical",
                  "product_label": "revenue",
                  "pair_ranking_eligible": true
                },
                {
                  "input_id": "revenue_prior",
                  "canonical_input": "revenue",
                  "mapping_key": "sec-cik:0000858877|revenue|us-gaap|RevenueFromContractWithCustomerExcludingAssessedTax|consolidated_periodic_filing",
                  "taxonomy_concept": "RevenueFromContractWithCustomerExcludingAssessedTax",
                  "accounting_perimeter": "consolidated_periodic_filing",
                  "disposition": "canonical",
                  "product_label": "revenue",
                  "pair_ranking_eligible": true
                }
              ],
              "output_class": "authoritative",
              "product_label": "financial.revenue_growth",
              "pair_ranking_eligible": true,
              "definition_id": "financial.revenue_growth/1.0.0",
              "restatement_state": "active_amendment_chain",
              "supersession_state": "active"
            },
            {
              "company_id": "sec-cik:0001596532",
              "security_id": "ticker:ANET",
              "source_observation_ids": [
                "sec-companyfacts:8579ed353a27f47e26ef9083df14448dd8f6fca4ff7c986aad0a486fc27000d7",
                "sec-companyfacts:cbae4ca1728083e6e556c698123016f3f2d46a7078a6952c9317fa484cb47f2e"
              ],
              "source_hashes": [
                "8579ed353a27f47e26ef9083df14448dd8f6fca4ff7c986aad0a486fc27000d7",
                "cbae4ca1728083e6e556c698123016f3f2d46a7078a6952c9317fa484cb47f2e"
              ],
              "available_at": "2026-02-14T00:12:46Z",
              "retrieved_at": "2026-07-24T10:32:53Z",
              "canonical_metric_id": "financial.revenue_growth",
              "metric_version": "1.0.0",
              "taxonomy_concept": "RevenueFromContractWithCustomerExcludingAssessedTax",
              "extension_mapping_id": "company-specific-us-gaap-revenues/v1:RevenueFromContractWithCustomerExcludingAssessedTax",
              "value": "0.2859590752666676186260370407391013",
              "unit": "ratio",
              "scale": 0,
              "sign_policy": "formula_defined",
              "dimensional_identity": "consolidated",
              "period_type": "duration",
              "fiscal_start": "2025-01-01T00:00:00Z",
              "fiscal_end": "2025-12-31T00:00:00Z",
              "filing_date": "2026-02-14T00:12:46Z",
              "accounting_perimeter": "revenue_current=consolidated_periodic_filing;revenue_prior=consolidated_periodic_filing",
              "accounting_inputs": [
                {
                  "input_id": "revenue_current",
                  "canonical_input": "revenue",
                  "mapping_key": "sec-cik:0001596532|revenue|us-gaap|RevenueFromContractWithCustomerExcludingAssessedTax|consolidated_periodic_filing",
                  "taxonomy_concept": "RevenueFromContractWithCustomerExcludingAssessedTax",
                  "accounting_perimeter": "consolidated_periodic_filing",
                  "disposition": "canonical",
                  "product_label": "revenue",
                  "pair_ranking_eligible": true
                },
                {
                  "input_id": "revenue_prior",
                  "canonical_input": "revenue",
                  "mapping_key": "sec-cik:0001596532|revenue|us-gaap|RevenueFromContractWithCustomerExcludingAssessedTax|consolidated_periodic_filing",
                  "taxonomy_concept": "RevenueFromContractWithCustomerExcludingAssessedTax",
                  "accounting_perimeter": "consolidated_periodic_filing",
                  "disposition": "canonical",
                  "product_label": "revenue",
                  "pair_ranking_eligible": true
                }
              ],
              "output_class": "authoritative",
              "product_label": "financial.revenue_growth",
              "pair_ranking_eligible": true,
              "definition_id": "financial.revenue_growth/1.0.0",
              "restatement_state": "active_amendment_chain",
              "supersession_state": "active"
            }
          ],
          "disposition": "comparable_with_caveat",
          "invariants": [
            {
              "invariant_id": "distinct_issuers",
              "passed": true
            },
            {
              "invariant_id": "same_metric",
              "passed": true
            },
            {
              "invariant_id": "same_metric_version",
              "passed": true
            },
            {
              "invariant_id": "same_unit",
              "passed": true
            },
            {
              "invariant_id": "same_currency",
              "passed": true
            },
            {
              "invariant_id": "same_scale",
              "passed": true
            },
            {
              "invariant_id": "same_sign_policy",
              "passed": true
            },
            {
              "invariant_id": "same_dimensions",
              "passed": true
            },
            {
              "invariant_id": "consolidated_dimensions",
              "passed": true
            },
            {
              "invariant_id": "same_period_type",
              "passed": true
            },
            {
              "invariant_id": "same_definition",
              "passed": true
            },
            {
              "invariant_id": "same_accounting_perimeter",
              "passed": true
            },
            {
              "invariant_id": "reviewed_accounting_perimeter",
              "passed": true
            },
            {
              "invariant_id": "ranking_eligible_accounting_perimeter",
              "passed": true
            },
            {
              "invariant_id": "same_restatement_state",
              "passed": true
            },
            {
              "invariant_id": "active_restatement_chain",
              "passed": true
            },
            {
              "invariant_id": "active_supersession",
              "passed": true
            },
            {
              "invariant_id": "annual_duration_periods",
              "passed": true
            },
            {
              "invariant_id": "bounded_fiscal_end_delta",
              "passed": true
            }
          ],
          "required_caveat_ids": [
            "different_filing_dates",
            "different_fiscal_periods"
          ],
          "reviewer_policy_version": "metric-comparability-annual-duration/v1",
          "request_sha256": "5cd03472b6d35e4906032c3c0e82eddaef50e038cfa839524ccb7c8cff2a984f",
          "generated_at": "2026-07-29T14:49:41Z",
          "receipt_sha256": "a8dd2d24ae0dcb7508f09f77dbef29df4d357d3824964ea466f293298ed8f531"
        },
        {
          "schema_version": "signalforge/metric-comparability-receipt/v2",
          "receipt_id": "comparability-8cbb267b71406860a07aacab",
          "request_id": "comparison-cisco-arista-financial-operating-margin",